{
  "$schema": "https://json-schema.org/draft/2020-12/schema",
  "$id": "https://my-knowledge-os.local/schemas/v2/projection.schema.json",
  "title": "My Knowledge OS projection input v2",
  "type": "object",
  "additionalProperties": false,
  "required": [
    "record_type",
    "id",
    "title",
    "current_revision",
    "review_head_id",
    "derived_state",
    "domain",
    "tags",
    "record_link",
    "asset_link"
  ],
  "properties": {
    "record_type": {
      "enum": [
        "source",
        "knowledge"
      ]
    },
    "id": {
      "type": "string",
      "pattern": "^personal-(source|knowledge)-[a-f0-9]{64}$"
    },
    "title": {
      "type": "string",
      "minLength": 1,
      "maxLength": 4096
    },
    "current_revision": {
      "type": "string",
      "pattern": "^sha256:[a-f0-9]{64}$"
    },
    "review_head_id": {
      "anyOf": [
        {
          "type": "string",
          "pattern": "^personal-review-[a-f0-9]{64}$"
        },
        {
          "type": "null"
        }
      ]
    },
    "derived_state": {
      "enum": [
        "unconfirmed",
        "deferred",
        "changes_requested",
        "revised_unconfirmed",
        "confirmed",
        "blocked"
      ]
    },
    "domain": {
      "type": "string",
      "minLength": 1,
      "maxLength": 256
    },
    "perspectives": {
      "type": "array",
      "maxItems": 5,
      "uniqueItems": true,
      "items": {
        "enum": [
          "life",
          "learning",
          "technical",
          "project",
          "investment"
        ]
      }
    },
    "tags": {
      "type": "array",
      "maxItems": 256,
      "items": {
        "type": "string",
        "minLength": 1,
        "maxLength": 256
      }
    },
    "record_link": {
      "type": "string",
      "minLength": 1,
      "maxLength": 4096,
      "pattern": "^[A-Za-z0-9._/-]+$",
      "not": {
        "pattern": "(^|/)\\.\\.?(/|$)"
      }
    },
    "asset_link": {
      "type": "string",
      "minLength": 1,
      "maxLength": 4096,
      "pattern": "^[A-Za-z0-9._/-]+$",
      "not": {
        "pattern": "(^|/)\\.\\.?(/|$)"
      }
    },
    "body_markdown": {
      "type": "string",
      "maxLength": 1048576
    },
    "summary": {
      "type": "string",
      "maxLength": 4096
    }
  },
  "allOf": [
    {
      "if": {
        "properties": {
          "record_type": {
            "const": "source"
          }
        }
      },
      "then": {
        "properties": {
          "id": {
            "pattern": "^personal-source-[a-f0-9]{64}$"
          },
          "perspectives": {
            "maxItems": 0
          }
        }
      }
    },
    {
      "if": {
        "properties": {
          "record_type": {
            "const": "knowledge"
          }
        }
      },
      "then": {
        "properties": {
          "id": {
            "pattern": "^personal-knowledge-[a-f0-9]{64}$"
          }
        }
      }
    }
  ]
}
